,API Name,Description,Category,Followers,Versions,API Tags,SDKs,How to,Source Code,Libraries,Developers,Changlog,Articles
284,TipsGOWalletAPI," The TipsGo Wallet API is used to track Cash savings. The Wallet API works together with the TipsGo Cashflow API. The Wallet APIs can be used to set and track various Saving Goals.
This API is part of the the TipsGo platform, which consists of:A comprehensive set of Tips that are relevant to the user's personal circumstancesA comprehensive database of products that can be used to allow product information and product comparisonA set of financial calculators that can be used to calculate the savings, revenues, benefits etc. based on the user’s personal circumstances and their geographic locationA comprehensive set of APIs (known as the TipsGo APIs) that can be used to access the features and capabilities of the platform from Mobile or Web applicationsAn extensive database that can capture information about the users, their families and connections from a financial perspectiveTipsGo is a recommendation based Money Management Platform. The TipsGo Platform provides Money Management ""Tips"" (recommendations) to its users. These tips help users make the most of their money by helping them save, grow/invest and protect their money.",Financial,2,RESTv1.0," Financial, Accounting, Transactions", 0,0,0,0, 0, 1,
285,TipsGOCountryAPI," The TipsGO Country API is a global or multi country API, specific to the country or geographic location. A good example of this type of API is financial market information APIs tax information. In order to support the multi-country features, Smart Wealth Tips (SWT) has a created the Country API to provide access to Country information.
This API is part of the the TipsGo platform, which consists of:A comprehensive set of Tips that are relevant to the user's personal circumstancesA comprehensive database of products that can be used to allow product information and product comparisonA set of financial calculators that can be used to calculate the savings, revenues, benefits etc. based on the user’s personal circumstances and their geographic locationA comprehensive set of APIs (known as the TipsGo APIs) that can be used to access the features and capabilities of the platform from Mobile or Web applicationsAn extensive database that can capture information about the users, their families and connections from a financial perspectiveTipsGo is a recommendation based Money Management Platform. The TipsGo Platform provides Money Management ""Tips"" (recommendations) to its users. These tips help users make the most of their money by helping them save, grow/invest and protect their money.",Countries,4,RESTv1.0," Countries, Financial, Location, Taxes", 0,0,0,0, 0, 0,
286,,,,,,,,,,,,,
287,VisaCTCRulesAPI," This API enables consumers to establish payment rules that will define the type of transactions they want prohibited. It also sends alerts to the issuer if the customer wishes to be notified of any prohibited transactions. Some key features include; gives cardholders the control and visibility they desire, build engagement and preference in the digital age, differentiate your cards with mobile innovation. Visa Consumer Transaction Controls allows you to offer cardholders the ability, via the issuer’s mobile banking application or online website, to set restrictions and alerts on how their cards are used.",Financial,5,RESTv1.0," Financial, Credit, Cards", 0,0,0,0, 0, 0,
288,TipsGOCurrencyAPI," The TipsGO Currency API provides a convenient way to access information about the world's currencies. It includes currency symbols and display formats. This API is part of the TipsGo platform, which consists of:
•	A comprehensive set of Tips that are relevant to the user's personal circumstances.
•	A comprehensive database of products that can be used to allow product information and product comparison.
•	A set of financial calculators that can be used to calculate the savings, revenues, benefits etc. based on the user’s personal circumstances and their geographic location.
•	A comprehensive set of APIs (known as the TipsGo APIs) that can be used to access the features and capabilities of the platform from Mobile or Web applications.
•	An extensive database that can capture information about the users, their families and connections from a financial perspective.
TipsGo is a recommendation based Money Management Platform. The TipsGo Platform provides Money Management ""Tips"" (recommendations) to its users. These tips help users make the most of their money by helping them save, grow/invest and protect their money.",Currency,3,RESTv2.0," Currency, Financial, International", 0,0,0,0, 0, 1,
289,TipsGOJobbingAPI," The TipsGo Jobbing API allow jobs posted by Job Owners to be easily matched to Job Seekers. Job Seekers receive instant notification of jobs and can bid and accept jobs instantly.
This API is part of the the TipsGo platform, which consists of:A comprehensive set of Tips that are relevant to the user's personal circumstancesA comprehensive database of products that can be used to allow product information and product comparisonA set of financial calculators that can be used to calculate the savings, revenues, benefits etc. based on the user’s personal circumstances and their geographic locationA comprehensive set of APIs (known as the TipsGo APIs) that can be used to access the features and capabilities of the platform from Mobile or Web applicationsAn extensive database that can capture information about the users, their families and connections from a financial perspectiveTipsGo is a recommendation based Money Management Platform. The TipsGo Platform provides Money Management ""Tips"" (recommendations) to its users. These tips help users make the most of their money by helping them save, grow/invest and protect their money.",Jobs,2,RESTv1.0," Jobs, Human, Resources, Notifications", 0,0,0,0, 0, 0,
290,TipsGOMemberAPI," The TipsGo Member API allows you to work with information of known users (Members) of the Smart Wealth Tips (SWT) Platform.
A Member is is a known user who is using the its services after having gone through a registration process in order to become a member of the platform.
Each Member is typically identified to the system by his or her email address. Within the SWT Framework, the Platform services are provided to the Member through a Service Provider. Every Member has a unique association or relationship with a Service Provider.
This API is part of the the TipsGo platform, which consists of:A comprehensive set of Tips that are relevant to the user's personal circumstancesA comprehensive database of products that can be used to allow product information and product comparisonA set of financial calculators that can be used to calculate the savings, revenues, benefits etc. based on the user’s personal circumstances and their geographic locationA comprehensive set of APIs (known as the TipsGo APIs) that can be used to access the features and capabilities of the platform from Mobile or Web applicationsAn extensive database that can capture information about the users, their families and connections from a financial perspectiveTipsGo is a recommendation based Money Management Platform. The TipsGo Platform provides Money Management ""Tips"" (recommendations) to its users. These tips help users make the most of their money by helping them save, grow/invest and protect their money.",Authentication,2,RESTv1.0," Authentication, API, Management, Security", 0,0,0,0, 0, 0,
291,TwitterObjectNestAPI," The Twitter Object Nest API allows developers to programmatically upload media and other assets to Twitter, a social microblogging service. The content type to be uploaded must be a valid media type as defined by the IANA. This API supports both resumable and non-resumable upload methods. For files >=64MB, only resumable uploads may be used.",Blogging,5,REST," Blogging, Media, Social, Tweets, Upload", 0,0,0,0, 0, 1,
292,VisaMerchantOffersDataAPI, This API provides developers a way to retrieve offer information from VMORC and allows you to retrieve all your available offers or retrieve specific offers. You may choose to filter your accessible offers by certain offer attributes or you may request offers by its identifiers. This allows issuers to retrieve the offer data available to them or filtered by offer attributes.,Financial,8,RESTv1.0," Financial, Credit, Cards", 0,0,0,0, 0, 0,
293,VisaMerchantReferenceDataAPI," This API provides developers the set of available reference data from VMORC, these values are mainly used in offer filtering criteria and values. Use the ""key"" information of each reference data option to conduct filtered offer requests and retrieve merchant address information for the requested merchants. The service will only return merchant address information associated to your accessible merchants and allows you to retrieve reference information.",Financial,4,RESTv1.0," Financial, Credit, Cards", 0,0,0,0, 0, 0,
294,VisaMerchantSearchAPI," This API allows you to search for merchant identification data using the acquirer provide name and card acceptor identifiers. Some key features include; search millions of merchants, receive enriched merchant profiles on demand and use key merchant identification information. Visa Merchant Search allows clients to search for merchant identification data to support their products and services.",Financial,6,RESTv1.0," Financial, Credit, Cards", 0,0,6,0, 0, 6,
295,VisaMerchantLocatorAPI," This API allows you to find Visa accepting merchants by geolocation and provides a way to search for Merchant Store Locations using the Merchant Name, Category, and geolocation filters such as Address or Postal Code. Some key features include; search millions of merchants across multiple merchant categories and find merchants around you, using your location. The Visa Merchant Locator service helps you easily locate merchants by specified category and location.",Financial,7,RESTv1.0," Financial, Credit, Cards", 0,0,6,0, 0, 6,
296,StatisticsNewZealandAPI," The Statistics New Zealand API integrates statistics into applications, targeting businesses, economic indicators, government & finance, income & work, and industry sectors. Available with HTTP requests to receive responses in XML and JSON formats.",Statistics,8,RESTv1.0," Statistics, Countries, Data, Demographics, European", 0,0,0,0, 0, 3,
297,W3CWebCryptoKeyDiscoveryAPI," The W3C WebCrypto Key Discovery API is a note that describes a JavaScript API for discovering cryptographic keys for use with the W3C Web Cryptography API. These keys must be named, origin-specific, and pre-provisioned. This document is still a work in progress and may be updated, replaced, or rendered obsolete at any time.",Security,3,Native/Browser," Security, Standards", 0,0,0,0, 0, 0,
298,AmazonAlexaFlashBriefingSkillAPI," The Amazon Alexa Flash Briefing Skill API is available after signing up for an Amazon developer account, for developers who know about HTTPS, RSS, and JSON formats. A user creates a Flash Briefing Skill by activating content preferences in the skills portal of the Alexa app. This allows businesses to use the Flash Briefing Skill API to create, format, and channel Flash Briefings such as previews to news, jokes, lists, and audio content.",Content,4,REST," Content, Audio, Blogging, Marketing, Media, News, Services, Newsletters, Publishing", 1,0,0,0, 0, 2, 1
299,AmazonDeveloperPublishingAPI, The Amazon Developer Publishing API allows developers to build new apps or upgrade existing ones. This API is restricted to developers with permission to participate in the developer preview. The selection process involves filling out a short questionnaire. Only successful developers are contacted with notification of access details. The API sends JSON-formatted requests and responses.,ApplicationDevelopment,4,REST," Application, Development, Applications", 0,0,0,0, 0, 2, 1
300,AmazonAlexaVoiceServiceAPI, The Alexa Voice Service (AVS) is a component of Amazon’s Alexa Skills Kit. When deploying the Amazon Alexa Voice Service API developers can use microphones and speakers to enable the voice functionality in cloud-connected products. The voice integration transforms the products into Alexa-compliant gadgets capable of accessing a variety of functionalities such as audio playback and speech recognition as well as volume control. The API sends requests and returns responses in JSON format. Developers must use the Login with Amazon portal to access the API’s authentication token.,InternetofThings,22,RESTv2," Internet, of, Things, Audio, Integration, Streaming, Voice", 0,0,0,0, 0, 4, 3
301,ECMAScript2015InternationalizationAPI," The ECMAScript 2015 Internationalization API offers localization and language tags as defined by the ECMA. This API returns information such as currencies, and time zones respective to different locales. Additionally, the Internationalization API offers language-sensitive data which includes string comparison (collation), number formatting, date and time formatting, and case conversion. ECMA offers services related to the standardization of information and communication systems. The contact info is Tel: +41 22 849 6000 and Fax: +41 22 849 6001. Located in Geneva, Switzerland.",Standards,4,Unspecifiedv2.0," Standards, International, Languages", 0,0,0,0, 0, 1, 1
302,GoogleWeaveAPI," Google Weave is a communications platform designed for IoT devices that supports phone-to-device-to-cloud communication, and user interaction from web applications and mobile. Weave features Android automatic application installations, and cloud support through mobile and desktop. Additionally, Weave offers Brillo support for building integrated and interoperable communications, and built-in easy-to-use sharing capabilities. Weave and Brillo require a program application per developer.",InternetofThings,12,RESTv1," Internet, of, Things, Application, Development, Cloud", 0,0,0,0, 0, 2, 1
303,QiitaAPI," Qiita offers integration with a collaboration and sharing platform. This platform features sharing and searching articles through the feed, comments, notifications, and chat. The Qiita API uses OAuth 2 for authentication, and JSON for data exchange. Increments is a Japan based software development firm that offers Qiita, Qiita:Team, and Kobito.",Collaboration,4,RESTv2," Collaboration, Application, Development, Chat, File, Sharing, Notifications", 0,0,0,0, 0, 1,
304,SparkRESOWebAPI," This API endpoint implements RESO's Web API and provides data using the RESO Data Dictionary version 1.1. Flexmls® IDX products enable Agents to display listings of other brokers in the MLS on their own website providing property searches to online consumers. The Flexmls® system by FBS is built on a standards-driven technology platform connecting real estate professionals to their customers via web, mobile and IDX.",RealEstate,9,RPC," Real, Estate", 0,0,0,0, 0, 2, 1
305,CanadianSalesTaxAPI," The Canadian Sales Tax API allows developers to integrate sales tax information with their applications by using the postal abbreviations of Canada. The following methods are available: Get the current GST (global sales tax), Get the current HST (harmonized sales tax) for a province, Get the current HST for all provinces, Get the current GST for a province, Get the current PST (provincial sales tax) for all provinces, Get the total applicable tax for a province, and Get the total applicable tax for all provinces. Currently, this API supports JSON for responses.",Taxes,11,RESTv1," Taxes, Business, Canadian, eCommerce, Financial, Sales", 0,0,0,0, 0, 4, 2
306,W3CCSSOMViewModuleAPI," The W3C CSSOM View Module API is a specification for APIs that provide methods for inspecting and manipulating the view of documents. These methods can get the position of element layout boxes, find the width of the viewport via script, and scroll an element. This document is a work in progress and may be updated, replaced, or rendered obsolete at any time.",Documents,2,Native/Browser," Documents, Standards, Visualizations", 0,0,0,0, 0, 0,
307,VisaCyberSourcePaymentsAPI," The CyberSource Payment REST API provides functionality for payment processing for authorization capture and settlement of card transactions worldwide. It allows you to process credit, debit and gift cards across multiple channels securely. This includes the The Flex API, which provides a secure method for tokenizing card data and reduces your PCI DSS burden. Card data is encrypted on the customer’s device and sent directly to CyberSource, bypassing your systems altogether. VISA CyberSource supports an extensive list of payment cards and offers a wide choice of gateways and acquiring banks, all through one connection.",Financial,12,RESTv1.0," Financial, Authorization, Credit, Cards", 0,0,6,0, 0, 7,
308,VisaDirectFundsTransferAPI," This API can pull funds from the sender's Visa account in an Account Funding Transaction (AFT). It also provides functionality to push funds to the recipient's Visa account in an Original Credit Transaction (OCT). If a transaction is declined, the Funds Transfer API can also return the funds to the sender's funding source in an Account Funding Transaction Reversal (AFTR). Visa Direct allows you to push payments to eligible Visa accounts, fund transfers from a variety of sources and the ability to use APIs inside ATM’s, mobile, web, and in-branch applications. It is a payment service that lets people ""push"" money to over 1 billion Visa accounts through the Original Credit Transaction (OCT). Visa Direct consumer and business applications include: Money Transfer, Prepaid Load, Credit Card Bill Pay and Funds Disbursements.",Financial,19,RESTv1.0," Financial, Credit, Cards, Payments, Transactions", 0,0,0,0, 0, 1,
309,VisaTokenServiceAPI," The Visa Token Service (VTS) is a security technology from Visa that replaces sensitive account information with a unique digital identifier called a token. The token allows payments to be processed without exposing actual account details that could potentially be compromised. Tools available are Service Enrollment, Provisioning, Lifecycle Management, Active Key Management, Card Metadata Manager, Token Display Request and Reporting. Some Key features include; protect sensitive information from theft and fraud, supports online, in-store, and mobile in-app purchases with flexible deployment and management options. The Visa Token Service allows issuers, merchants, and wallet providers the ability to deliver secure mobile payment applications, gain access to third-party digital payment experiences, or securely maintain cards on file.",Financial,15,REST," Financial, Credit, Cards, Privacy, Security", 0,0,0,0, 0, 1,
310,FacebookWorkplaceGraphAPI," The Facebook Workplace Graph API offers a way to send object data in and out of Workplace's platform. This data is represented in a Facebook 'social graph'. Available Workplace information is composed of Nodes, Edges, and Fields. Nodes are photos, posts, comments, and users. Edges represent the connections between Nodes. Fields display details about Nodes such as a person's birthday. Workplace Graph is a low-level HTTP API that requires Tokens for authentication.",Social,19,REST," Social, Data, Organization", 0,0,0,0, 0, 2, 1
311,AmazonIn-AppPurchasingAPI, The Amazon In-App Purchasing API simplifies the integration of transactional and functional features in ecommerce apps. It allows developers to create portal for posting offerings or executing subscriptions and purchases of digital content and other products within apps. This makes it possible for Amazon customers to access and purchase the digital content and other product offerings. The API’s infrastructure consists of unique receipt identifiers that simplify the conveyance of the purchased in-app items to customers.,eCommerce,16,RESTv2," eCommerce, Inventory, Ordering, Payments, Purchasing, Sales, Transactions", 0,0,0,0, 0, 1, 1
312,,,,,,,,,,,,,
313,TipsGOLocationAPI," The TipsGo Location API enables the user to browse a list of bank Branches/ATMs with location information.
This API is part of the the TipsGo platform, which consists of:A comprehensive set of Tips that are relevant to the user's personal circumstancesA comprehensive database of products that can be used to allow product information and product comparisonA set of financial calculators that can be used to calculate the savings, revenues, benefits etc. based on the user’s personal circumstances and their geographic locationA comprehensive set of APIs (known as the TipsGo APIs) that can be used to access the features and capabilities of the platform from Mobile or Web applicationsAn extensive database that can capture information about the users, their families and connections from a financial perspectiveTipsGo is a recommendation based Money Management Platform. The TipsGo Platform provides Money Management ""Tips"" (recommendations) to its users. These tips help users make the most of their money by helping them save, grow/invest and protect their money.",Banking,3,RESTv1.0," Banking, Financial, Location", 0,0,0,0, 0, 0,
314,TipsGOProductAPI," The Smart Wealth Tips (SWT) Platform provides a comprehensive product catalog that helps identify products that are suitable for a person based on their personal circumstances.
The TipsGo Product API allows you to manipulate product information in the product catalog within the SWT Platform.
This API is part of the the TipsGo platform, which consists of:A comprehensive set of Tips that are relevant to the user's personal circumstancesA comprehensive database of products that can be used to allow product information and product comparisonA set of financial calculators that can be used to calculate the savings, revenues, benefits etc. based on the user’s personal circumstances and their geographic locationA comprehensive set of APIs (known as the TipsGo APIs) that can be used to access the features and capabilities of the platform from Mobile or Web applicationsAn extensive database that can capture information about the users, their families and connections from a financial perspectiveTipsGo is a recommendation based Money Management Platform. The TipsGo Platform provides Money Management ""Tips"" (recommendations) to its users. These tips help users make the most of their money by helping them save, grow/invest and protect their money.",APIManagement,2,RESTv1.0," API, Management, Financial", 0,0,0,0, 0, 0,
315,TipsGORegisterAPI," The TipsGO Register API is a register controller that allows you to register new members and create temporary members within the Smart Wealth Tips (SWT) Platform
This API is part of the the TipsGo platform, which consists of:A comprehensive set of Tips that are relevant to the user's personal circumstancesA comprehensive database of products that can be used to allow product information and product comparisonA set of financial calculators that can be used to calculate the savings, revenues, benefits etc. based on the user’s personal circumstances and their geographic locationA comprehensive set of APIs (known as the TipsGo APIs) that can be used to access the features and capabilities of the platform from Mobile or Web applicationsAn extensive database that can capture information about the users, their families and connections from a financial perspectiveTipsGo is a recommendation based Money Management Platform. The TipsGo Platform provides Money Management ""Tips"" (recommendations) to its users. These tips help users make the most of their money by helping them save, grow/invest and protect their money.",Registration,2,RESTv1.0," Registration, API, Management, Authentication", 0,0,0,0, 0, 0,
316,TipsGOTipsAPI," In the Smart Wealth Tips (SWT) Platform, the term ""Tip"" is used to refer to a financial (or money related) recommendation that is provided to a Member (user) of the platform. These Tips help the Member to better manage their money. Tips can relate to saving money, growing money through investing, or protecting money through insurance.
This API is part of the the TipsGo platform, which consists of:A comprehensive set of Tips that are relevant to the user's personal circumstancesA comprehensive database of products that can be used to allow product information and product comparisonA set of financial calculators that can be used to calculate the savings, revenues, benefits etc. based on the user’s personal circumstances and their geographic locationA comprehensive set of APIs (known as the TipsGo APIs) that can be used to access the features and capabilities of the platform from Mobile or Web applicationsAn extensive database that can capture information about the users, their families and connections from a financial perspectiveTipsGo is a recommendation based Money Management Platform. The TipsGo Platform provides Money Management ""Tips"" (recommendations) to its users. These Tips help users make the most of their money by helping them save, grow / invest and protect their money.",APIManagement,3,RESTv1.0," API, Management, Background, Financial", 0,0,0,0, 0, 0,
317,BBVASecurityAPI, This API enables BBVA Clients to give an application consent to access BBVA Compass services on their behalf. In this API you will find detailed information about the services available to obtain tokens needed to call any service defined. The BBVA API Market is a platform for global financial services for business.,Financial,2,RESTv1.0," Financial, Authentication, Authorization, Banking", 0,0,0,0, 0, 2, 1
