,API Name,Description,Category,Followers,Versions,API Tags,SDKs,How to,Source Code,Libraries,Developers,Changlog,Articles
577,SharethroughAPI," Sharethrough is an advertising firm based in San Francisco. The Sharethrough platform offers monetization management, engagement analytics, and on-demand native advertisement supply with the Sharethrough Exchange. Native advertising yields twice the visual focus and more consumer attention than their non-native counterparts. Developers need to register to access API documentation.",Advertising,2,REST," Advertising, Automation, Monetization", 2,0,2,0, 0, 1, 1
578,BitportAPI," The Bitport API allows developers to create torrent related extensions and plugins. The Bitport platform is used to download torrents to the cloud, and play them online. All the work is done by Bitport's servers; so, the user's IP address is kept secure. Also, torrents can be accessed anywhere, and big torrents are downloaded faster.",Torrents,12,RESTv2," Torrents, Cloud, Streaming", 0,0,0,0, 0, 2, 2
579,PredictHQAPI," The PredictHQ API is a gateway to a broad range of scheduled and unscheduled event categories. From public holidays, school holidays and observances, to concerts, festivals, performing arts, community, sports, conferences, expos, daylight savings, airport delays, severe weather, natural disasters and even terror. The API allows users to filter events and integrate it into their target products or applications to operate as a single source of data for events. All events have a numeric ranking so developers have the ability to further filter by major to minor events.",Events,11,RESTv1.0," Events, Air, Travel, Analytics, Business, Community, Holidays, Intelligence, Location, Music, Predictions, Sports, Travel, Weather", 2,0,2,0, 0, 7, 2
580,ConnektInfiniteScrollingWPAPI," This REST API is an Ajax Load More add-on for Wordpress that allows infinite scrolling. The WordPress REST API V 2.0 add-on works by routing the standard Ajax Load More requests through to API endpoints for data retrieval. The data is returned as JSON, displayed using JS templates on the front-end of your website. Using a simple GET request, a JavaScript Repeater Template and a custom endpoint developed specifically for Ajax Load More, users are able to access website data and infinite scroll the results using the WP REST API.",Data,2,RESTv2.0, Data, 0,0,0,0, 0, 0,
581,FomoAPI," The Fomo API allows developers to integrate social proof into their websites and apps to increase the rate of on-page conversions. Fomo can display recent customer actions - such as purchases, newsletters, and sign-ups - to help motivate other potential customers to do the same. Fomo started out as a Shopify plugin and now serves over 3,000 websites.",Marketing,3,RESTv1," Marketing, eCommerce, Social", 4,0,0,0, 0, 1, 1
582,ArukasAPI," With the Arukas API, developers can control, create or edit applications and manage containers. Arukas Cloud is a docker-based Container-as-a-service Heroku-inspired workflow allowing for ease to deployment and management of apps at scale. Fully supported release with the ability to with applications Ubuntu, Node.js, Ruby, Python, Redis, and PHP.",DevOps,7,REST," DevOps, Application, Development", 0,0,0,0, 0, 3, 2
583,MicrosoftGrooveServiceAPI," This API allows you to connect your app or website to the world of Microsoft Groove Music. Get the details of an album, an artist or a track, search for any album, artist or track, get the top and newest albums of an artist, get a deep link that redirects nicely to the Groove applications, on the Web, Windows Phone, Windows, or any other platform, get album covers, artist images and more.",Music,6,RESTv1.0," Music, Media, Search", 1,0,0,0, 0, 2, 1
584,VizdumFlexiblePushAPI," The Push REST API allows developers to push information into Vizdum's business analytics dashboards from a third party application. These personalized dashboards offer campaign tracking, data visualization, and real time monitoring. Data is sent in JSON format. Vizdum is a B2B software provider based in California.",B2B,4,REST," B2B, Dashboards", 0,0,0,0, 0, 3, 1
585,BookerMerchantAPI," Use this API to build an application for a merchant to view their appointment schedule, schedule new appointments, check-in guests, process payments and more. Booker is an all-in-one local service commerce platform that helps business owners with their customer base, book appointments, process payments, manage employees and manage long-term client relationships.",Booking,5,VersionRESTv4.0RecommendedRPCv4.0Recommended," Booking, Scheduling", 0,0,0,0, 0, 2, 1
586,Proximi.ioRESTAPI," Proximi.io is a unified API to all mobile positioning technologies that allows you to build location-aware applications. Access all the major mobile positioning technologies through a simple platform, then use the location data to trigger action flow chains to gain realtime analytics about your app users' movements. Manage your beacons’ positions and venue information by defined areas with geofences. Geofences can be used for triggering mobile or external actions or to collect analytics. Mobile actions – deliver location based advertisement, coupons, information, or change the application layout. External actions – information about where your visitors are moving indoors and outdoors. Proximity Platform provides experiences applied to various fields including; retail, events, health, tourism, construction, advertising and more.",Analytics,4,RESTv1.0," Analytics, Location", 2,0,0,0, 0, 1, 1
587,EuropaLeagueLiveScoresAPI," The Europa League Live Scores REST API allows developers to access and integrate Europa League Live Scores with other applications. The main API methods are retrieving current season results, scorers, lineups, substitutes, events, and statistics with live updates for EUFA Europa League.",Sports,10,REST," Sports, Fantasy, Sports", 0,0,0,0, 0, 1, 1
588,AudiosearchSwaggerAPI," The Audiosear.ch Swagger API allows developers to access and integrate the functionality of Audiosear.ch with other applications. Some example API methods include retrieving audio recommendations based on networks, shows, categories, and topics. Audiosear.ch is a full-text search & recommendation API for podcasts and radio.",Podcasts,6,RESTv1," Podcasts, Audio, Media, Recommendations, Search", 0,0,0,0, 0, 1, 1
589,AIBMSAuthipayConnectSoapAPI," This API manages all of your interactions with credit card processors, financial institutions and alternative payment providers. Examples are available in ASP and PHP. Connect works in PayOnly mode, collects a minimum set of information for the transaction. PayPlus Mode, the gateway also collects a full set of billing information and FullPay Mode, collects all available information including; billing, shipping and more. AIB Merchant Services is a provider of payment solutions, with operations in Ireland and Britain, and with card processing capabilities throughout continental Europe.",Payments,3,RPCv1.0," Payments, Authorization", 0,0,0,0, 0, 0,
590,AtomParkAtomicSMSAPI," The Atomic SMS API offers bulk SMS sending automation. Advertising and marketing can be facilitated with this free of charge REST API. Responses use the JSON format. AtomPark Software is a mass-marketing tool provider with offices in United States, Russia, Australia, Ukraine, Spain, and Latvia.",Messaging,4,RESTv3.0," Messaging, Advertising, Marketing", 0,0,0,0, 0, 1, 1
591,AIBMSAuthipayVirtualTerminalSoapAPI," This SAOP API provides access to a central location where you can manage everything related to transaction processing with Authipay. Run secure transactions yourself, set up your web site to run transactions for you, review transaction reports and more. Languages available in English, Dutch, French, German, Italian and Portuguese. AIB Merchant Services is a provider of payment solutions, with operations in Ireland and Britain, and with card processing capabilities throughout continental Europe.",Payments,2,RPC," Payments, Authorization", 0,0,0,0, 0, 0,
592,HeapAnalyticsCustomIdentifyAPI," This Javascript API manages custom events and users, allowing you to tie mobile and web sessions together into a single user identity. Tag a user with an email address, payment plan, total revenue, age, or anything else you need to measure. Heap captures user interactions, tracking events automatically, with no extra code needed including; clicks, taps, gestures, form submissions, page views, and more. Heaps web and iOS libraries will work with Google Analytics or other third-party services.",Analytics,2,Indirectv2.0, Analytics, 0,0,2,0, 0, 4, 2
593,AIBMSAuthipayWebServiceSOAPAPI," This SOAP API allows you to connect your application with the First Data Internet Payment Gateway. The AIB Authipay API offers you a way to accept online payments using 3D Secure, a payments industry authentication standard for internet/eCommerce purchases. AIB Merchant Services is a provider of payment solutions, with operations in Ireland and Britain, and with card processing capabilities throughout continental Europe.",Payments,2,RPCv1.0, Payments, 0,0,0,0, 0, 0,
594,VonageNexmoVoiceAPI," The Vonage Nexmo Voice API allows developers to build high-quality voice applications in the cloud. With the Voice API, developers can build apps that scale with web technologies already in use, control the flow of inbound and outbound calls, record and store inbound or outbound calls, create conference calls, and send text-to-speech messages in 23 languages with different genders and accents.
This API is part of a suite provided by Vonage (formerly Nexmo) for managing customer communications.",Voice,2,VersionRESTv1.0RecommendedRESTv2.0RecommendedStreamingv1.0Recommended," Voice, Telephony, Text-to-Speech", 3,0,5,0, 0, 18, 3
595,MediaWikiSwaggerAPI," The MediaWiki Swagger API allows developers to access and integrate the functionality of MediaWiki with other applications and websites. Some example API methods include retrieving wiki content, editing wiki content, and managing content. MediaWiki provides the functionality of wikis, including Wikipedia, for text and HTML content creation and editing.",Wiki,10,RESTv2," Wiki, Open, Source, Reference", 1,0,0,0, 0, 3, 2
596,MovidaLabsDeevaAPI," The Movida Labs Deeva API offers a video processing system that extracts specific information such as entities, people, organizations, keywords, and locations. This system can be used to offer customer recommendations based on extracted information. Potential applications include tagging and transcribing, SEO, and video content search. The Deeva API requires API Keys for authentication, and responds in JSON and XML.",Video,4,REST," Video, Documents, Media, Recommendations, Search", 0,0,0,0, 0, 2, 1
597,PerimeterXBotDefenderAPI," The Bot Defender API is a service that protects websites from attacks such as price-scraping bots, brute force attacks, and click fraud. This service uses an approach based on dynamic behavior profiles of real customers which eases the identification of malicious bots. This API evaluates traffic with said method and provides reports for analyzed threats and traffic. PerimeterX is an IT firm based in California.",Security,3,REST," Security, Bots, Web, Site, Management", 3,0,3,0, 0, 2, 1
598,,,,,,,,,,,,,
599,StatSocialAPI," The StatSocial REST API allows developers to access and integrate the functionality of StatSocial with other applications and websites. Some example API methods include retrieving various types of reports, creating and running custom reports, and managing the application. StatSocial is a platform that provides brands and businesses with information about their social media reach and followers.",Social,4,RESTv1," Social, Analytics, Statistics", 0,0,0,0, 0, 1, 1
600,SecureNetPayOSRESTAPI," This API enables the user to run transactions in a credit card present (CP) or credit card not present (CNP) environment using Worldpay. Functionality includes customer management tools for managing payment accounts and the ability to enable recurring billing to automatically bill customers at specified intervals. Worldpay is a partner in payments processing that helps businesses accept all payment types in-person, online and on-the-go.",Payments,3,REST, Payments, 2,0,0,0, 0, 0,
601,QuriiriSMSGatewayAPI," The Quriiri REST API allows developers to access and integrate the functionality of Quriiri with other applications. Some example API methods include sending messages, retrieving responses, and retrieving messaging reports. Quriiri is a Finnish SMS gateway that allows for sending and receiving SMS messages.",Messaging,2,RESTv1," Messaging, Mobile, Nordic", 0,0,0,0, 0, 1, 1
602,WatchfulSwaggerAPI," The Watchful Swagger API allows developers to access and integrate the functionality of Watchful with other applications and websites. Example API methods enable developers to backup, upgrade, and monitor Joomla websites from a remote location. This REST API about secure website management supports XML, JSON, JSONP, and serialized protocols. In the site, programmers can find resources, API Keys, authentication instructions, formats, error handling, and examples in PHP. Watchful.li allows users to keep Joomla websites safe with regular updates, maintenance, and backups.",WebSiteManagement,2,RESTv1," Web, Site, Management, Safety, Security, Validation, Verification", 0,0,0,0, 0, 2, 1
603,IconFinderRESTAPI," This API allows users access to a library of icons through IconFinder. All data is sent as UTF-8 encoded JSON identified by the media type. Filtering options include sizes, format, licenses, styles, categories and more. It is also possible to search inside a single icon sets or a specific designer. IconFinder is a search tool for graphic designers and web developers.",Images,3,RESTv2.0," Images, Graphics", 0,0,0,0, 0, 3, 1
604,PageLrScreenshotServiceAPI, The PageLr REST API allows developers to access and integrate the functionality of PageLr with other applications and websites. The main API method is retrieving website screenshots as PNG or JPG images with desired parameters as set. PageLr provides functionality to take website screenshots as PNG or JPG images.,Screenshots,5,RESTv1.2," Screenshots, Images", 0,0,0,0, 0, 2, 1
605,WordnikSwaggerAPI," The Wordnik Swagger API allows developers to access and integrate the functionality of Wordnik with other applications through Open API standards. Some example API methods include retrieving definitions, retrieving words, and managing dictionaries through JavaScript. Wordnik is a non-profit online dictionary that provides definitions for words and phrases.",Reference,19,RESTv2," Reference, Dictionary, Spelling", 4,0,0,0, 0, 6, 2
606,ChampionsLeagueLiveScoresAPI," The Champions League Live Scores REST API allows developers to access and integrate Europa League Live Scores with other applications. The main API methods are retrieving current season results, scorers, lineups, substitutes, events, and statistics with live updates for EUFA Champions League.",Sports,35,REST," Sports, Data, Entertainment, Fantasy, Sports", 0,0,0,0, 0, 1, 1
607,MakemojiAPI," Makemoji is a monetizable emoji keyboard designed for mobile applications. It offers Flashtag technology for searching the entire emoji library, frequently used and trending categories. Also, Makemoji offers user real-time tracking for targeted banner advertisements, and data management based on Amazon S3 servers. Developers need to register in order to access API documentation.",Images,1,REST," Images, Monetization", 3,0,3,0, 0, 1, 1
608,IFSCBankCodesAPI," The IFSC Bank Codes REST API allows developers to access and integrate the functionality and of IFSC Banks with other applications and websites. Some example API methods include retrieving banks by IFSC code, retrieving banks by MICR code, and searching for codes. IFSC Bank provides data, codes, and information about banks in India.",Banking,33,RESTv1.0," Banking, Data, Financial", 0,0,0,0, 0, 2,
609,ZoomConnectSMSSwaggerAPI," The Zoom Connect SMS Swagger API allows developers to access and integrate the functionality of Zoom Connect's SMS functionalities with other applications. Some example API methods include sending and scheduling SMS messages, retrieving account balances, and managing contacts and groups. Zoom Connect provides a platform and various features for bulk and marketing SMS messages.",Messaging,3,RESTv2," Messaging, Telephony, Text", 0,0,0,0, 0, 1, 1
610,ZoomConnectSMSAPI," The Zoom Connect SMS API allows developers to access and integrate the functionality of Zoom Connect's SMS functionalities with other applications. Some example API methods include sending and scheduling SMS messages, retrieving account balances, and managing contacts and groups. Zoom Connect provides a platform and various features for bulk and marketing SMS messages.",Messaging,2,RESTv1," Messaging, Telephony, Text", 0,0,0,0, 0, 1, 1
611,RiotGamesTournamentsAPI," This Rest API allows you to create a new tournament provider for a given region, generate tournament codes, receive game results, query pre-game lobby player activity and more. Riot Games provide the League of Legends developer community with access to game data in a secure and reliable way.",Games,19,RESTv1.0," Games, Statistics", 1,0,0,0, 0, 4, 4
612,BookerCustomerAPI," Use this API if you are building an application for customers to search for availability and book appointments. It allows you to search for available appointment times, book an appointment, cancel an appointment and view past appointments. Booker is an all-in-one local service commerce platform that helps business owners with their customer base, book appointments, process payments, manage employees and manage long-term client relationships.",Booking,10,VersionRESTv4.0RecommendedRPCv4.0Recommended, Booking, 0,0,0,0, 0, 0,
613,RiotGamesLeagueAPI," This API allows you access to statistics on League of Legends. It includes recent games, ranked statistics, runes, masteries and more. Riot Games provide the League of Legends developer community with access to game data in a secure and reliable way.",Games,19,RESTv2.5," Games, Statistics", 2,0,0,0, 0, 5, 4
614,ConfirmAPI," The Confirm authentication platform allows developers to integrate government issued IDs verification functionalities with their applications. This allows businesses to certify a client's identity for any transaction that benefits from proof of identity. Confirm features image optimizer, forensic authentication with advanced pattern analysis, and ID data extraction. Data is transmitted over SSL and AES 256 encryption standards.",Authentication,5,REST," Authentication, Identity, Profiles", 2,0,2,0, 0, 2, 1
615,xkcdSwaggerAPI," xkcd provides a Swagger RESTful API that uses JSON calls to retrieve files contain comic titles, URLs, post dates, transcripts, and other metadata. This metadata is provided in an easily-parsed, plaintext format. xkcd is a webcomic consisting of non-sequential strips about math, language, programming, and the nature of reality in general.",Entertainment,12,RESTv2," Entertainment, Humor", 0,0,0,0, 0, 0,
616,PubMLSTRESTAPI, This REST API allows third-party applications to retrieve data stored within BIGSdb databases or to send new submissions to database curators. PubMLST is a public database for molecular typing and microbial genome diversity.,Science,4,REST," Science, Data, Genetics, Medical", 0,0,0,0, 0, 1,
617,INRFOODRESTAPI," This REST API allows you to discuss and share with others and view your diet with advanced analytics using a nutritional product database and provide you access to build upon it. INRFOOD is working with a team of dieticians, nutritionists, to create a place for all these ingredients to be defined.",Food,19,RESTv3.0," Food, Dieting, Health, Nutrition", 0,0,0,0, 0, 1,
618,Keyword.ioAPI," The Keyword.io API integrates keywords features into web services, spreadsheets, and mobile applications. It is available in JSON architecture with HTTP requests and token as authentication.",Keywords,5,REST," Keywords, Data, Spreadsheets, Words", 0,0,0,0, 0, 0,
619,shiftmailemailanalyticsAPI," The shiftmail Email Analytics API is a useful solution for capturing, tracking, viewing, and storing the crucial data associated with the transmission, delivery, receipt, and sharing of emails. The API provides analytical feedback of how recipients interacted with sent emails, including details such as time of receipt, duration of reading and recipient’s geographic location as well as actions such as printing or forwarding of the email.",Analytics,5,RESTv1.0," Analytics, Campaigns, Data, Email, Intelligence, Predictions, REST", 0,0,0,0, 0, 3, 1
620,InteractiveDataCompanyAPI," The Interactive Data API integrates a real-time system that offers financial market data. Also, it offers analytics and related solutions to financial institutions, active traders and individual investors. This API supports 160+ currencies and commodity data, historical exchange rates, personalized commodity currency data, and hard-to-value instruments. The Interactive Data API is REST based, requires API Keys for authentication, and responds in XML, CSV, XLS, and JSON.",Financial,10,REST," Financial, Bitcoin, Business, Currency, Data-as-a-Service, Open, Data, Stocks", 0,0,0,0, 0, 4, 1
621,WinningEmailAPI," The Winning Email REST API allows developers to access and integrate the functionality of Winning Email with other applications. Some example API methods include scanning emails to suggest words for clickthroughs, retrieving rate limits, and retrieving status of email campaigns. Winning Email provides email marketing campaign services.",Email,2,RESTv1," Email, Campaigns, Marketing", 0,0,0,0, 0, 1, 1
622,H2OFlintAPI," This API allows you to access a list of water and supply distribution locations that are open for the next 7 days, with latitude and longitude points, address information, open hours, and supplies available/needed. H2o Flint is a city data project that leverages technology to change the human condition by providing reliable, real-time information about water and other resources that are available at local distribution sites in Flint, Michigan.",Government,11,REST," Government, Cities, Water", 0,0,0,0, 0, 2, 1
623,FactualCPGProductsAPI," This API provides product data for over 650,000 consumer packaged goods, including; health, beauty, food, beverage, and household products. With CPG Products, you can access key product attributes, find products using powerful search tools or UPC lookup, and connect to product pages across the web. Factual is an open data platform for application developers that leverages large-scale data aggregation and community exchange.",Products,9,RESTv3.0," Products, Barcodes, Open, Data", 0,0,0,0, 0, 2, 1
624,,,,,,,,,,,,,
625,YunbiAPI," The Yunbi REST API allows developers to access and integrate the functionality of Yunbi with other applications. Some example API methods include managing currency trades, managing verifications, and managing accounts and orders. Yunbi is a cryptocurrency trading platform.",Cryptocurrency,4,REST," Cryptocurrency, Banking, Bitcoin, Currency, Financial", 0,0,0,0, 0, 1, 1
626,YunbiSwaggerAPI," The Yunbi Swagger API allows developers to access and integrate the functionality of Yunbi with other applications. Some example API methods include managing currency trades, managing verifications, and managing accounts and orders. Yunbi is a cryptocurrency trading platform.",Cryptocurrency,1,RESTv2," Cryptocurrency, Banking, Bitcoin, Currency, Financial", 0,0,0,0, 0, 1, 1
627,VisualSearchAPIVisualSearchAPI, The VisualSearchAPI Visual Search integrates image and photo results by interacting with machine learning capabilities. It is available in JSON architecture with HTTP requests and XML responses.,Search,5,REST," Search, Images, Machine, Learning, Photos", 0,0,0,0, 0, 1, 1
628,HarvardUniversityCS50CoursesAPI," This API provides a RESTful interface and allows you to request data programmatically from CS50 Courses in JSON, JSONP, or XML format. At least once per day, CS50 synchronizes with the Courses of Instruction and because FAS offers so many courses, this API tends to return a lot of data. For best performance, you should cache your own copy locally and synchronize with this API once per day. CS50 is a programming course offered through Harvard University and made available a set of APIs for use with the class.",Education,7,RESTv1.0, Education, 0,0,0,0, 0, 1, 1
629,TeletextAPI," The Teletext API provides on demand Teletext data in XML format. This system offers data from 83 channels still operating around Europe. Teletext is free to use, but developers need to obtain an API Key. For requests, this API uses the SOAP format.",Video,14,RPCv1.0," Video, Text", 0,0,0,0, 0, 1, 1
630,UniversityDomainsandNamesDataListAPI," The University Domains and Names Data List API by Hipo Labs retrieves JSON files with domains, names, and countries of national and international universities. Created by @hipolabs, developers of web and mobile.",Lists,46,REST," Lists, Countries, Domains, Education, Names", 0,0,0,0, 0, 3, 3
