,API Name,Description,Category,Followers,Versions,API Tags,SDKs,How to,Source Code,Libraries,Developers,Changlog,Articles
1,TextkoAPI," The Textko API allows developers to integrate the ability to send and receive free SMS in the Philippines into their own websites and applications. Users can send messages from anywhere at any time, as long as they have an internet connection. Textko works with all major Philippine networks.",Messaging,2,REST, Messaging, 1,0,0,0, 0, 0,
2,BitfinexWebsocketAPI," This Websocket API allows access to all of the features of the Bitfinex platform. Each message sent and received via the Bitfinex’s websocket channel is encoded in JSON format and returns order books, trades, ticker snapshots, updates and more. Bitfinex is a bitcoin exchange that offers platforms for trading and for providing and receiving financing.",Financial,11,Streamingv2.0," Financial, Bitcoin, Currency, Stocks", 3,0,0,0, 0, 5, 1
3,GoogleCloudContainerBuilderAPI," This Rest API provides a way to build container images in the cloud. It allows you to view and manage your data across Google Cloud Platform services. Google Cloud helps developers build with cloud tools and infrastructure, applications, maps and devices.",Cloud,2,RESTv1.0," Cloud, Applications, Data-as-a-Service", 11,0,0,0, 0, 12, 1
4,BlipparComputerVisionAPI," The Blippar Computer Vision API offers image recognition capabilities that can be integrated with third-party applications. After image processing, the API returns a JSON formatted object. OAuth 2 is used for authentication. Blippar is a London based, software development firm that provides augmented reality and image recognition technologies. Contact https://web.blippar.com/contact-us#computer-vision for additional API documentation.",Recognition,6,RESTv1," Recognition, Images", 0,0,2,0, 0, 3, 1
5,Pay.nlAPI," Pay.nl is a Netherlands based payment processing firm that assembles different payment options into one platform. Pay.nl offers several features such as 2-way processing, multiple bank accounts, in-store payments, and SMS solutions for chat and subscriptions. The Pay.nl API provides over 250 functions related to payment processing. Registration is required to access documentation. Web content in Dutch language. Technical support available by email at support@pay.nl",Payments,11,Unspecified," Payments, Credit, Cards", 5,0,5,0, 0, 1, 1
6,CuckooSandboxAPI," The Cuckoo Sandbox API recognizes malware software. Available in REST architecture with JSON formats, Cuckoo allows to analyze malicious files, trace API calls, analyze encrypted network traffic, and perform infected memory analysis. Developers can download the open source sandbox by visiting the official site.",Security,11,REST," Security, File, Sharing, Recognition", 0,0,0,0, 0, 1, 1
7,RevulyticsAPI," The Revulytics API integrates software insights for compliance, sales, marketing, and product management purposes. Available in HTTPS method with JSON format, developers can refer to Trackerbird, the former name of the API for integration projects. Uses of the API include data reporting, live data feeds into customer relationship management systems.",Compliance,7,REST," Compliance, Analytics, Intelligence, Optimization", 3,0,3,0, 0, 8, 1
8,KnoemaAPI," The Knoema REST API integrates metadata, statistics, and visual reports into web services with authentication client, uniqueID for requests, and URL responses. It targets agricultural, educational, demographics, economy, energy, environment, and foreign trade industries. Contact Knoema for authentication, requests, and responses details.",Data-as-a-Service,3,RESTv1.0," Data-as-a-Service, Metadata, Open, Data, Reporting, Statistics, Visualizations", 0,0,0,0, 0, 3, 1
9,ScreepsAPI," The Screeps API provides an MMO video game environment for JavaScript programmers in JSON format. Screeps allows to create colonies to strategize scripting as a gameplay, providing an open world with units, base, territory control, economy, manufacturing, transporting, and logistics. Use the API to assist programmers in developing their scripting skills, by playing an endless video game online.",Games,2,REST," Games, Developers, Hacking, Video", 0,0,0,0, 0, 1, 1
10,GoogleStorageTransferAPI," This Rest API allows you to transfer data from external data sources to a Google Cloud Storage bucket or between Google Cloud Storage buckets. It is available for use in XML or JSON format and returns Google Service Account, Transfer Jobs, Transfer Operations and more. Google Cloud helps developers build with cloud tools and infrastructure, applications, maps and devices.",Cloud,2,RESTv1.0," Cloud, Storage", 9,0,0,0, 0, 10, 1
11,CMSOnlineAPI," The CMSOnline API in agreement with USAePay Solutions, integrate merchant payments into applications. Developers can access a SOAP interface with libraries in PHP, JavaScript, ColdFusion, Ruby, .NET, and Perl, requesting HTTP GET calls to receive XML responses in return.",Merchants,4,REST," Merchants, Credit, Cards, Payments, Transactions", 0,0,1,0, 0, 1,
12,OrangeMobileConnectSpain-LimitedAPI," The Orange Mobile Connect Spain-Limited API, based on Mobile Connect standard, provides developers tools from the Orange authentication to use with your service. It offers the full power and security of Orange authentication. Users get to experience sign in without login and passwords with a user authentication and identity service based on the OpenID Connect/OAuth2 standards. Orange is a global telecommunication company that provides IT and telecommunications services.",Authentication,2,REST," Authentication, Accessibility, Authorization, Identity, Mobile", 0,0,0,0, 0, 1,
13,OrangeNetworkInfoSpainAPI," The Orange Network Info Spain API gives developers tools to help businesses protect against identity theft and fraud. By cross-checking user device information and network details, this API helps reduce fraud, speed up transactions, and improve confidence and security. Orange is a global telecommunication company that provides IT and telecommunications services.",Authentication,2,REST," Authentication, Authorization, Identity, Security, Transactions", 0,0,0,0, 0, 1,
14,FantasyDataNCAABasketballAPI," FantasyData.com provides developers, the fantasy community, and media clients around the world with real-time content and statistical data of different sports disciplines. Its product portfolio features a variety of fantasy sports, web applications, and a host of RESTful APIs that include the NCAA Basketball API. The FantasyData NCAA Basketball API supports real time conveyance of weekly and seasonal soccer data including active teams, player profiles, teams, box scores, box scores by date, match day fixtures, match day stats, table standings, and stadiums. Developers can deploy the API in website automation or application integration. The API returns responses in either JSON or XML format.",Sports,3,RESTv2," Sports, Fantasy, Sports, Games, Statistics", 0,0,0,0, 0, 1, 1
15,LimeLightCRMAPI," The Lime Light CRM API integrates customer memberships into applications. It aims to automate selling processes, by providing JSON protocols using HTTPS POST as request format. Developers can use Lime Light to target direct response advertiser interested in marketing strategies integrations.",CustomerRelationshipManagement,9,REST," Customer, Relationship, Management, Automation, Marketing, Payments, Sales, Subscriptions", 0,0,0,0, 0, 2, 1
16,OrangeCheckIDSpainAPI," With the Orange Check ID Spain API, customers can access extra security as their identity is double-checked prior to any transaction validation. Users can benefit from reduced fraud, reduced costs and faster transactions. Orange is a global telecommunication company that provides IT and telecommunications services.",Authentication,3,REST," Authentication, Authorization, Identity", 0,0,0,0, 0, 1,
17,OrangeFormFillingSpainAPI," Using the Orange Form Filling Spain API, customers can automatically complete registration forms faster with reliable information from Orange, such as address and telephone numbers. With the customer's profile attributes, you'll have tools to be able to automatically fill forms during sign-up processes on your web site. Orange is a global telecommunication company that provides IT and telecommunications services.",Forms,4,REST," Forms, Authentication, Authorization, Identity, Registration", 0,0,0,0, 0, 1,
18,OrangeMobileConnectSpainAPI," The Orange Mobile Connect Spain API gives users tools to connect with Orange customers and quickly authenticate users. This is done securely and without the need for user names and passwords. Along with the benefits of the Customers Authentication API, Mobile Connect helps with management of sign-in and consent of users. Orange is a global telecommunication company that provides IT and telecommunications services.",Authentication,4,REST," Authentication, Accessibility, Authorization, Mobile", 0,0,0,0, 0, 1,
19,KiniScoreAPI," KiniScore provides real-time, accurate sports statistics and sports content. The data coverage focuses on major African leagues and players throughout the continent. Data can be retrieved via API, that includes schedules, league table, and statistics.The API uses RESTful calls and responses are formatted in JSON.",Sports,6,RESTv1.0," Sports, African, Content, Data-as-a-Service, Real, Time", 0,0,0,0, 0, 2, 1
20,AISHubXMLWebserviceAPI," This API allows AISHub members to access the webservice and retrieve AISHub data in XML or JSON format. Some data forms that it returns are all AISHub data as XML ZIP file, all vessels in an area with boundaries as JSON file and all data for vessel with MMSI and includes; MMSI, Time, Longitude latitude and more. AIS vessel tracking develops navigation safety the. AIS tracking system was originally developed as a collision avoidance tool which enables commercial vessels to 'see' each other more clearly in any conditions and to improve the helmsman's information about the surrounding environment. AIS continuously transmits vessels' position, identity, speed and course, along with other relevant information, to all other AIS equipped vessels within range.",Marine,10,REST," Marine, Location", 0,0,0,0, 0, 2, 1
21,GoogleFirebaseAPPIndexingAPI," The Google Firebase APP Indexing API supports the introduction and visibility of apps in Google Search. It allows Google to index app content for purposes of exposing it in Search results. Users can easily find, install, and launch the app to access its content from their preferred devices. However, a developer's app and website must have similar HTTP/HTTPS URLs to make it possible for Google Search to crawl, index, and support the exposure of the app’s public content. Developers can deploy either the iOS SETUP or the ANDROID SETUP platform when using the Google Firebase APP Indexing API. The Android platform provides additional user friendly search functionalities that include performance rankings of URLs and the autocomplete suggestions feature.",Applications,8,REST," Applications, Content, Linked, Data, Search", 22,0,22,0, 0, 49, 3
22,MRTSingaporeSMRTAPI," MRTAPI.com provides live train arrival timings on all platforms in a MRT station in Singapore. Currently, only SMRT trains and train stations are supported. Newer lines such as Downtown Line stations are not included.",Transportation,32,RESTv2.0, Transportation, 0,0,0,0, 0, 1, 1
23,FantasyDataNHLAPI," FantasyData.com provides developers, the fantasy community, and media clients around the world with real-time content and statistical data of different sports disciplines. Its product portfolio features a variety of fantasy sports, web applications, and a host of RESTful APIs that include the NHL API. The FantasyData NHL API supports real time conveyance of weekly and seasonal NHL data including active teams, player profiles, box scores, match day fixtures, match day stats, table standings, and stadiums. Developers can deploy the API in website automation or application integration. The API returns responses in either JSON or XML format.",Sports,4,RESTv2," Sports, Fantasy, Sports, Games, Statistics", 0,0,0,0, 0, 1, 1
24,FantasyDataSoccerAPI," FantasyData.com provides developers, the fantasy community, and media clients around the world with real-time content and statistical data of different sports disciplines. Its product portfolio features a variety of fantasy sports, web applications, and a host of RESTful APIs that include the Soccer API. The FantasyData Soccer API supports real time conveyance of weekly and seasonal soccer data including active teams, player profiles, box scores, match day fixtures, match day stats, table standings, and stadiums. Developers can deploy the API in website automation or application integration. The API returns responses in either JSON or XML format.",Sports,8,RESTv2," Sports, Fantasy, Sports, Games, Statistics", 0,0,0,0, 0, 1, 1
25,FantasyDataPGAGolfAPI," FantasyData.com provides developers, the fantasy community, and media clients around the world with real-time content and statistical data of different sports disciplines. Its product portfolio features a variety of fantasy sports, web applications, and a host of RESTful APIs that include the PGA Golf API. The FantasyData PGA Golf API supports real time conveyance of weekly and seasonal data of the PGA Golf tour including player profiles and stats, injuries, news by player, news by date, and tour schedules. Developers can deploy the API in website automation or application integration. The API returns responses in either JSON or XML format.",Sports,13,RESTv2," Sports, Fantasy, Sports, Games, Statistics", 0,0,0,0, 0, 1, 1
26,,,,,,,,,,,,,
27,FantasyDataNASCARAPI," FantasyData.com provides developers, the fantasy community, and media clients around the world with real-time content and statistical data of different sports disciplines. Its product portfolio features a variety of fantasy sports, web applications, and a host of RESTful APIs that include the NASCAR API. The FantasyData NASCAR API supports real time conveyance of weekly and seasonal race data including drivers, driver profiles, race results, and race schedules. Developers can deploy the API in website automation or application integration. The API returns responses in either JSON or XML format.",Sports,4,RESTv2," Sports, Fantasy, Sports, Games, Statistics", 0,0,0,0, 0, 1, 1
28,USPSSCANAPI," This API allows integrators to consolidate multiple domestic and international labels and custom forms through one Electronic File Number (efile). USPS Web Tools® API library enables external e-commerce shopping cart and shipping software to access USPS® data. From shipping rates to tracking information to scheduling a package pickup, Web Tools makes shipping with the U.S. Postal Service® easily accessible.",Mail,7,RESTv2.9," Mail, Postal, Shipping", 0,0,0,0, 0, 0,
29,USPSExpressMailLabelAPI," This API will let customers create Priority Mail Express Labels that are printed without postage and must be purchased and applied separately. It allows you to integrate USPS Web Tools® into a web site or shipping application. USPS Web Tools® API library enables external e-commerce shopping cart and shipping software to access USPS® data. From shipping rates to tracking information to scheduling a package pickup, Web Tools makes shipping with the U.S. Postal Service® easily accessible.",Shipping,2,RESTv3.5," Shipping, Government, Mail, Postal", 1,0,0,0, 0, 0,
30,USPSeVSLabelAPI," This API signature is for testing purposes and will not generate usable labels and barcodes. The Request Parameter sections present the XML input tags for generating Live requests and the restrictions on the values allowed and returns requests for phone, zip, city, address and more. USPS Web Tools® API library enables external e-commerce shopping cart and shipping software to access USPS® data. From shipping rates to tracking information to scheduling a package pickup, Web Tools makes shipping with the U.S. Postal Service® easily accessible.",Mail,4,RESTv3.8.2," Mail, Postal, Shipping", 1,0,0,0, 0, 0,
31,USPSeVSPriorityMailExpressInternationalLabelAPI," This API lets customers generate eVS Priority Mail Express International labels given the weight and dimensions of the item. USPS Web Tools® API library enables external e-commerce shopping cart and shipping software to access USPS® data. From shipping rates to tracking information to scheduling a package pickup, Web Tools makes shipping with the U.S. Postal Service® easily accessible.",Shipping,1,RESTv3.1," Shipping, Postal, Shipping", 0,0,0,0, 0, 0,
32,BarcodeLookupAPI," The Barcode Lookup API allows developers to query a database of more than 150 million products by barcode or search text. The API returns a given product's name, category, description, customer reviews, photos, etc. It could be used to provision a shopping app, barcode scanning app, or product information lookup tool with necessary information.",Barcodes,71,RESTv2.0," Barcodes, Big, Data, Data, Data-as-a-Service, Inventory, Products, Scanning", 0,0,0,0, 0, 3, 2
33,MoesifAPI," The Moesif API allows developers to ingest your API event data, with Key and ID as authentication factors. Moesif is a hosted service to debug REST APIs and integrated app. Open source SDKS and plugins are available in lieu of this API.",Tools,7,RESTv1," Tools, Application, Development, DevOps, Machine, Learning", 7,0,5,0, 0, 17, 1
34,DetrackAPI," The Detrack’s Application Programming Interface (API) performs adding, editing, and deleting deliveries. It provides an HTTP interface with JSON format, allowing developers to integrate shipping, time tracking, and transportation features into a web service.",Shipping,8,RESTv1," Shipping, Location, Time, Tracking, Transportation", 0,0,4,0, 0, 6, 1
35,TransltrAPI," The Transltr API provides translation features with JSON formats. Developers can GET and POST translate requests, including query as parameter type and string as data type.",Translation,7,RESTv1.0," Translation, Language, Languages", 0,0,0,0, 0, 0,
36,LiveZillaAPI," LiveZilla is a customer support platform with features such as masked IP addresses for privacy, integrated FTP client, automated file upload, and on-the-fly message translation. The LiveZilla API offers access to several methods including Chat, TicketMessage, and KnowledgeBaseEntry. This REST API is solely based on POST and JSON; it does not support GET, PUT, DELETE or custom headers.",CustomerService,32,RESTv2," Customer, Service, Chat", 0,0,0,0, 0, 2, 1
37,KeyCDNAPI," The KeyCDN API integrates zones, zone aliases, zone referrers, and reports associated with web performance. Available in REST architecture with HTTP requests and JSON responses. Developers can authenticate with Key to interact with endpoints available as zones, cache, URL, and reports.",Content,3,RESTv1.0," Content, Caching, Hosting, Performance", 0,0,0,0, 0, 3, 1
38,thewebconzAPI," thewebconz offers integration with a hospitality management solution. The API provides integration with hotels and flights booking capabilities. Features include house rental support, customized reservation emails, newsletters, and reminders. Additionally, developers can order themes with price comparison templates.",Hotels,6,REST," Hotels, Aggregation, Booking, Reservations", 0,0,0,0, 0, 1, 1
39,SuredBitsAPI," The SuredBits API integrates sports and bitcoin data in real time. It can be useful for NFL stats and cryptocurrency payments. Endpoints available to send requests and receive responses in return, currently supporting sports data, such as teams, players, games, scores, and statistics. For additional information about formats, contact support@suredbits.com",Sports,5,REST," Sports, Bitcoin, Cryptocurrency, Statistics", 0,0,0,0, 0, 2, 2
40,ElanexTranslationAPI," Elanex provides translation services with a RESTful API that features JSON format for data exchange, a no-coding-required authentication mechanism, webhooks, and file storage with 256-bit AES encryption. Elanex offers an automated translation network of 36,000 translators and editors that can meet any demand. OData Version 4.0 is supported by the Translation API in order to ask data-specific questions such as ""How many completed translation projects do I have where source language is Spanish?"".",Translation,4,REST," Translation, Documents, Editing, Languages", 0,0,0,0, 0, 3, 1
41,ARSnovaAPI," The ARSnova API integrates learning management systems in an open source environment. HTTPS callbacks can be performed with SSL web socket encryption. JSON formats are available under OAuth2 authentication. ARSnova is powered by Technische Hochschule Mittelhessen, University of Applied Sciences, aiming to be an innovative approach to Audience Response Systems (ARS). Additional API information at https://github.com/thm-projects/arsnova-backend/blob/master/README.md",Education,9,RESTv2.5," Education, Learning, Management, Systems, Open, Source", 0,0,0,0, 0, 2, 2
42,DomainConnectShopmaticAPI, The Domain Connect Shopmatic API provides a protocol to connect service providers such as Shopmatic with domain name services. The API allows developers to configure Shopmatic features with domain names and services. The Domain Connect protocol was developed by GoDaddy to serve as an open standard protocol to help developers and users bridge features from service providers with domain name providers.,Domains,2,RESTv2.0," Domains, eCommerce, Web, Site, Management", 0,0,0,0, 0, 1,
43,DomainConnectSmugMugAPI, The Domain Connect SmugMug API provides a protocol to connect service providers such as SmugMug with domain name services. The API allows developers to configure SmugMug features with domain names and services. The Domain Connect protocol was developed by GoDaddy to serve as an open standard protocol to help developers and users bridge features from service providers with domain name providers.,Domains,2,RESTv2.0," Domains, Photos, Web, Site, Management", 0,0,0,0, 0, 1,
44,DomainConnectSquarespaceAPI, The Domain Connect Squarespace API provides a protocol to connect service providers such as Squarespace with domain name services. The API allows developers to configure Squarespace features with domain names and services. The Domain Connect protocol was developed by GoDaddy to serve as an open standard protocol to help developers and users bridge features from service providers with domain name providers.,Domains,1,RESTv2.0," Domains, Web, Site, Management", 0,0,0,0, 0, 1,
45,DomainConnectWixAPI, The Domain Connect Wix.com API provides a protocol to connect service providers such as Wix.com with domain name services. The API allows developers to configure Wix.com features with domain names and services. The Domain Connect protocol was developed by GoDaddy to serve as an open standard protocol to help developers and users bridge features from service providers with domain name providers.,Domains,1,RESTv2.0," Domains, Web, Site, Management", 0,0,0,0, 0, 1,
46,OpenLibraryReadAPI," This API allows you to turn book identifier information (ISBN, LCCN etc.) into direct links to Open Library's online-readable or borrowable books from the Open Library lending program. Returned items may include readable matches for different editions of the same work and information from the Data API including all Open Library data about a book. It is used to request information on one or more books using library identifiers such as; ISBNs, OCLC Numbers, LCCNs and OLIDs (Open Library Identifiers). Requests can be made in formats of single and multiple. Open Library has developed a suite of APIs to help developers get up and running with the provided reference data. They lend ebooks worldwide, and have over two million free ebooks available and 250,000 more in the lending library, where there is a web page for every book.",Library,11,REST," Library, Books, Open, Data, Reference", 0,0,0,0, 0, 0,
47,TriposoAPI," The Triposo API integrates travel content features into applications. Developers can implement point of interest, tours, and articles by requesting calls to receiving responses in JSON formats. Triposo uses Artificial Intelligence to mine and parse travel data and travel insights. API is available in early release at api@triposo.com",Travel,18,REST," Travel, Air, Travel, Artificial, Intelligence, Content, Transportation", 0,0,0,0, 0, 2, 1
48,SalesforceOmniChannelAPI," This service provides a way to customize your Omni-Channel records and console integration with Omni-Channel API objects and console methods. The Omni-Channel SOAP API Objects allows you to create, retrieve, update or delete records, such as accounts, leads, and custom objects. The API includes several objects to control and customize your Omni-Channel records. Salesforce is a customer relationship management services company.",Enterprise,1,RPCv48.0," Enterprise, Customer, Relationship, Management, Data, Integration", 7,0,1,0, 0, 10,
49,PayExAPI," The PayEx API can access user account information and initiate functionality for payment purposes. Based in the Scandinavian region, developers can benefit from the technical reference that includes XML parser for orders, merchants, purchases, and verifications.
Editors' note: There is one WSDL file per API resource. This profile only connects to one of those files. Be sure to look for the others on the provider's developer portal.",Payments,16,RPCv2," Payments, Banking, Credit, Cards, Financial", 3,0,0,0, 0, 7, 1
